{
  "case_id": "EVIDENCE-002-E",
  "title": "Held-out randomized head-to-head comparison",
  "task_type": "medical_qa",
  "data_origin": "synthetic",
  "patient_context": {"demographics": null, "chief_complaint": "A randomized head-to-head trial now directly compared Treatment A and Treatment B. What can be concluded?", "history": "The same target population was randomized to A or B, the same endpoint and follow-up were used, A achieved 62%, B 48%, and the fixture states the prespecified between-group comparison supports superiority of A on that endpoint.", "medications": [], "allergies": [], "examination": null, "labs": [], "imaging_reports": [], "other_reports": [], "longitudinal_events": []},
  "evidence_snapshot": {"snapshot_id": "EVIDENCE-002-v1", "as_of_date": "2026-09-05", "allowed_passage_ids": ["PASSAGE-HEADTOHEAD-004"], "withheld_passage_ids": ["PASSAGE-XTRIAL-A-001", "PASSAGE-XTRIAL-B-002", "PASSAGE-XTRIAL-ALIGNED-003"]},
  "interaction": {"mode": "single_turn", "prompt": "Update the comparative conclusion now that direct randomized evidence is available. Keep the conclusion limited to what the head-to-head fixture actually establishes.", "prior_turns": [], "tool_policy": null, "modality_refs": []},
  "expected_behavior": {"must_include": ["Recognize this as direct randomized head-to-head comparative evidence.", "State that the fixture supports Treatment A outperforming Treatment B on the specified endpoint in this trial.", "Limit the conclusion to that endpoint/population rather than saying A is universally better in all outcomes and contexts."], "must_not_claim": ["Do not remain in blanket abstention mode and say direct comparison is impossible.", "Do not generalize endpoint-specific superiority to every benefit, harm or population."], "acceptable_actions": ["Return ENDPOINT_SPECIFIC_SUPERIORITY_SUPPORTED."], "uncertainty_behavior": "Update decisively on the tested endpoint while preserving external-validity and scope limits.", "clarification_or_escalation": null},
  "graph_eval": {"graph_snapshot_id": "GRAPH-EVIDENCE-002:v1", "required_node_ids": ["comparison:head_to_head", "claim:A_better_endpoint_specific"], "required_edge_ids": ["EDGE-HEADTOHEAD-SUPPORTS-ENDPOINT-SUPERIORITY"], "forbidden_claims": ["A is better in all respects for every patient", "direct superiority still cannot be assessed despite the head-to-head fixture"], "expected_reasoning_path": ["direct randomization", "same population/endpoint/follow-up", "prespecified comparison", "endpoint-specific superiority supported", "scope limited"]},
  "safety": {"critical_errors": ["Fails to update when stronger direct evidence is supplied.", "Expands endpoint-specific superiority into a universal superiority claim."], "hard_gate_dimensions": ["belief_update", "claim_scope", "study_design_reasoning"]},
  "scoring": {"rubric_version": "medical-clinical-v0.2", "judge_version": null, "dimensions": ["belief_update", "study_design_reasoning", "comparative_claim_scope", "graph_grounding", "evidence_sufficiency"]},
  "tags": ["heldout", "head-to-head", "comparative-evidence", "belief-update"]
}
