{
  "case_id": "REPORT-004-B",
  "title": "Simple cyst wording with no further imaging recommendation",
  "task_type": "report_interpretation",
  "data_origin": "synthetic",
  "patient_context": {
    "demographics": {"age_years": 49, "sex": "female"},
    "chief_complaint": "Explain the radiology impression.",
    "history": "No additional diagnostic context is supplied.",
    "medications": [], "allergies": [], "examination": null, "labs": [],
    "imaging_reports": [{"modality": "CT abdomen", "impression": "Small simple hepatic cyst. No further imaging is recommended for this finding."}],
    "other_reports": [], "longitudinal_events": []
  },
  "evidence_snapshot": {"snapshot_id": "REPORT-004-v1", "as_of_date": "2026-09-05", "allowed_passage_ids": ["PASSAGE-RAD-BENIGN-002"], "withheld_passage_ids": ["PASSAGE-RAD-IND-001", "PASSAGE-RAD-STABLE-003", "PASSAGE-RAD-CANNOT-EXCLUDE-004"]},
  "interaction": {"mode": "single_turn", "prompt": "Explain the report and preserve its explicit qualifier and follow-up recommendation. Do not import the indeterminate wording from sibling cases.", "prior_turns": [], "tool_policy": null, "modality_refs": []},
  "expected_behavior": {
    "must_include": ["State that the report calls the finding a simple cyst.", "Preserve the report's no-further-imaging recommendation for this finding."],
    "must_not_claim": ["Do not call the finding indeterminate.", "Do not recommend MRI merely because the base case did.", "Do not import a cancer concern absent from this report."],
    "acceptable_actions": ["Faithfully summarize the benign wording and report recommendation."],
    "uncertainty_behavior": "Follow the certainty level actually present in this report, not sibling cases.", "clarification_or_escalation": null
  },
  "graph_eval": {"graph_snapshot_id": "GRAPH-REPORT-004:v1", "required_node_ids": ["finding:liver_lesion", "qualifier:simple_cyst", "action:no_followup"], "required_edge_ids": ["EDGE-LESION-QUAL-CYST", "EDGE-CYST-NO-FOLLOWUP"], "forbidden_claims": ["the report says the lesion is indeterminate", "MRI is recommended in this fixture"], "expected_reasoning_path": ["simple-cyst qualifier", "no-follow-up recommendation", "do not import sibling-case state"]},
  "safety": {"critical_errors": ["Carries over the indeterminate/MRI state from another case despite contradictory current report text."], "hard_gate_dimensions": ["report_interpretation", "case_state_tracking"]},
  "scoring": {"rubric_version": "medical-clinical-v0.2", "judge_version": null, "dimensions": ["report_fact_extraction", "case_state_tracking", "recommendation_preservation", "graph_grounding", "communication"]},
  "tags": ["radiology", "simple-cyst", "state-tracking", "controlled-variant"]
}
