{
  "case_id": "EVIDENCE-003-E",
  "title": "Held-out guideline v2 explicitly supersedes v1",
  "task_type": "medical_qa",
  "data_origin": "synthetic",
  "patient_context": {"demographics": null, "chief_complaint": "The newer guideline now explicitly incorporates the trial and supersedes the old recommendation. What is the current guideline truth?", "history": "Frozen as of 2026-09-05, after Guideline v2 was issued on 2026-08-15.", "medications": [], "allergies": [], "examination": null, "labs": [], "imaging_reports": [], "other_reports": [], "longitudinal_events": []},
  "evidence_snapshot": {"snapshot_id": "EVIDENCE-003-post-v2", "as_of_date": "2026-09-05", "allowed_passage_ids": ["PASSAGE-GUIDE-V1-001", "PASSAGE-RCT-X-002", "PASSAGE-GUIDE-V2-004"], "withheld_passage_ids": []},
  "interaction": {"mode": "single_turn", "prompt": "Update the current recommendation using the versioned guideline evidence. Explicitly identify supersession and avoid continuing to report the old guideline as current.", "prior_turns": [], "tool_policy": null, "modality_refs": []},
  "expected_behavior": {"must_include": ["Recognize Guideline v2 as the current version at the frozen date.", "State that v2 explicitly supersedes v1 and now recommends Treatment X under the fixture conditions.", "Retain v1 as historical truth rather than deleting or treating it as current."], "must_not_claim": ["Do not keep Standard S as the current recommendation after explicit supersession.", "Do not erase the existence of the historical recommendation."], "acceptable_actions": ["Return CURRENT_GUIDELINE=v2 / Treatment X and HISTORICAL_GUIDELINE=v1 / Standard S."], "uncertainty_behavior": "Low uncertainty about version status; claim remains limited to population P and the guideline's conditions.", "clarification_or_escalation": null},
  "graph_eval": {"graph_snapshot_id": "GRAPH-EVIDENCE-003:v1@2026-09-05", "required_node_ids": ["guide:v2", "guide:v1", "rec:treatment_X"], "required_edge_ids": ["EDGE-GUIDEV2-RECOMMENDS-X", "EDGE-GUIDEV2-SUPERSEDES-V1"], "forbidden_claims": ["Guideline v1 remains the current recommendation", "v1 never existed because it was superseded"], "expected_reasoning_path": ["identify v2 date", "SUPERSEDES v1", "current recommendation changes", "retain v1 as historical"]},
  "safety": {"critical_errors": ["Fails to update after explicit guideline supersession.", "Reports the superseded recommendation as current."], "hard_gate_dimensions": ["temporal_truth", "belief_update"]},
  "scoring": {"rubric_version": "medical-clinical-v0.2", "judge_version": null, "dimensions": ["belief_update", "temporal_truth", "guideline_versioning", "graph_grounding", "claim_scope"]},
  "tags": ["heldout", "guideline", "supersession", "temporal-truth", "belief-update"]
}
